id1,id2,comment1,comment2,similarity
507,941,動機 は なん だっ た の でしょ う ？ ,サイコパス だっ た の か ？ ,0.244266831
126,1029,抜群 の 頭脳 の 良 さ を 持っ て いる 薬品 会社 の 研究 員 の 人 が 　 薬物 殺害 で 死後 死因 検査 を する の は わかっ てる はず な のに 容易 に 他殺 と 判る やり方 で 殺害 する か なぁ ？ ,メタノール で 殺害 ？ ,0.244252555
255,479,何 か 意味 深 な 理由 が ある の かも しれ ない 。 ,記事 に は 、 夫 が 妻 を 殺す 理由 の 説明 が ない 。 ,0.244219125
6,697,薬学 の 知識 が ある 人 が 殺人 を 考える の なら 、 当然 証拠 の 残ら ない 方法 を 考える でしょ う 。 ,殺人 犯 。 ,0.244194316
416,968,容疑 者 、 被害 者共 に 薬 の プロ だ し 、 容疑 者 の 自白 が 無い と 起訴 は 難しい 様 に 思い ます 。 ,1 番 の 被害 者 は 子供 か な ？ ,0.244014553
398,697,この ひと も 、 お 勉強 が でき て 頭 が 良い の か と 思い き や 、 放火 も 殺人 も すぐ に バレる よう な 犯行 しか し て い ない 。 ,殺人 犯 。 ,0.244001092
291,916,夫婦 の こと は 夫婦 に しか わから ない けれど 、 お子さん は ショック だろ う な … ,夫婦 で 高学歴 だ と 難しい の か ね 。 ,0.24398854
482,819,すぐ バレる こと は 分かる でしょ ！ ,薬品 に 超 詳し そう な エリート の この 方 が そんなに すぐ バレる 殺害 方法 を 選ぶ の か なあ ,0.243971516
36,59,なお 、 メタノール は 燃料 用 アルコール として 、 ホームセンター なんか で も 購入 できる よう な ので 、 どこ から 手 に 入れ た か を 調べる の は 結構 大変 かも しれ ませ ん ね 。 ,アルコール ランプ の 燃料 は メタノール です よ ね 。 ,0.243960745
226,969,ご 夫婦 優秀 な 研究 員 な のに 残念 で なら ない 。 ,あー 、 優秀 な 人 だっ た のに 何 が 狂っ て しまっ た ん でしょ う 。 ,0.243920177
23,689,そもそも 、 薬物 に 詳しい 人 が 致死 量 の メタノール 飲ま せ て ばれ ない と は 思わ ない の で は ？ という か 、 そもそも メタノール を 選ぶ ？ ？ ,そもそも 殺害 を 企図 する 時点 で 精神 が 病ん で いる 。 ,0.243882554
562,679,夫 に は 殺す 理由 が ある という か 、 記事 に は 書け ない 秘密 の 暴露 的 な 、 、 、 逮捕 に 至る 理由 が ある の だろ う けど 。 。 。 ,一月 に 死亡 し て 今頃 逮捕 に なっ た 理由 は なん な ん だろ う ？ ,0.24383963
670,676,お母さん は 殺さ れ て 、 お父さん は 刑務所 。 ,殺さ れ た 京大 大学院 出 の 妻 。 ,0.243690537
26,540,まだ 容疑 者 の 段階 な ので 、 冤罪 かも しれ ない し … ,これ さ 、 冤罪 だっ たら 、 サリン 事件 の 冤罪 と 同じ だ よ 。 ,0.243687221
177,569,メタノール なんて なん に でも 入っ てる だろ う 。 ,製薬 会社 の 人間 が わざわざ メタノール なんて 使用 する の だろ う か 。 ,0.243659587
327,597,何 が あっ た の でしょ う か ,何 か の 間違い で あっ て ほしい 、 そう 思う の は 私 だけ か な 。 ,0.243606908
255,687,何 か 意味 深 な 理由 が ある の かも しれ ない 。 ,風紀 が 自由 な 社則 な の かも しれ ない けど 、 もっと 清潔 感 出し て 爽やか に 製薬 し て 欲しい なぁ 。 ,0.243593637
421,840,しかも お子さん が いる 。 ,お子さん は お母様 を 亡くさ れ た 上 に 、 父親 が 逮捕 、 それ も 母親 の 殺害 容疑 って 、 、 、 お子さん が 可哀想 すぎる 。 。 ,0.243593129
533,981,嫌 なら 離婚 すれ ば 良い だけ だろ う 。 ,頭 が 良い よう で 悪い ん だろ う な 、 、 、 バレる に 決まっ てる ,0.243571245
259,961,なんか 、 コナン の 事件 とか に 出 て き そう な 事件 。 ,安い ドラマ の よう な 事件 だ ,0.243567155
862,947,普通 に 別居 とか 離婚 とか じゃ 済まなかっ た の か ？ ,それ が 妻 に ばれ て 殺害 し た とか ,0.243543302
106,116,万一 、 やっ て なかっ たら どう する の ？ ,完全 犯罪 に する 気 は なかっ た ん だろ う と は 思う 。 ,0.243541133
234,580,メタノール って 、 いわゆる メチルアルコール でしょ ？ ,研究 職 って なかなか 就職 難しい ん でしょ ？ ,0.243519915
140,410,会社 に も メタノール が あり ます 。 ,本人 は 否認 し て いる ので まだ 不 確定 で は あり ます が 、 この 状況 は 、 お子さん が 可哀想 です 。 ,0.243505469
952,1010,２ 時間 ドラマ の よう な 事件 ,変 な 事件 多い よ ！ ？ ,0.243485136
591,877,恥 で も 何 でも あり ませ ん 。 ,でも 、 行為 は 稚拙 。 ,0.243474947
281,721,どうして 殺さ なけれ ば なら なかっ た の か ・ ・ 動機 が 気 に なり ます 。 ,動機 解明 が 待た れ ます ね 。 ,0.243451772
247,533,当然 解剖 すれ ば 、 薬物 が で て き て 、 疑わ れる だろ う し 。 ,嫌 なら 離婚 すれ ば 良い だけ だろ う 。 ,0.243403518
67,349,家庭 を 見る に 、 残さ れ た 子供 は 両親 を 失っ た も 同然 気の毒 で は ある けど 、 生き て いか なく て は なら ない とても 受け入れ られ ない 現実 で は ある だろ う けど 、 子供 の 精神 的 な ケア と 教育 面 で の 変わら ない フォロー も 大切 だ と 思う ,子供 が 不憫 で なら ない ・ ・ ・ 。 ,0.243322603
67,350,家庭 を 見る に 、 残さ れ た 子供 は 両親 を 失っ た も 同然 気の毒 で は ある けど 、 生き て いか なく て は なら ない とても 受け入れ られ ない 現実 で は ある だろ う けど 、 子供 の 精神 的 な ケア と 教育 面 で の 変わら ない フォロー も 大切 だ と 思う ,子供 が 不憫 で なら ない ,0.243322603
177,793,メタノール なんて なん に でも 入っ てる だろ う 。 ,毒 母 は 見 てる だけ 。 ,0.243272876
27,448,なんとも 言え ませ ん が 、 少なくとも 、 お母さん を 亡くし て 、 お父さん も これから 取調べ ( 逮捕 と なれ ば 帰っ て は 来 ない でしょ う ) と なる 、 小学生 の 息子 さん の こと が 、 不憫 で なり ませ ん 。 ,『 毒 と 薬 は 匙加減 一つ 』 と 言わ れ ます が 、 ここ まで 人生 の 匙加減 を 間違える と は ・ ・ ・ そして 、 残さ れ た 息子 さん が 不憫 で なり ませ ん 。 ,0.243268111
225,717,子供 が かわいそう だ 。 ,子供 も いる のに 、 薬殺 ？ ,0.243209137
348,717,子供 が かわいそう だ 。 ,子供 も いる のに 、 薬殺 ？ ,0.243209137
717,894,子供 も いる のに 、 薬殺 ？ ,子供 も かわいそう だ 。 ,0.243209137
344,562,理由 が 知り たい です 。 ,夫 に は 殺す 理由 が ある という か 、 記事 に は 書け ない 秘密 の 暴露 的 な 、 、 、 逮捕 に 至る 理由 が ある の だろ う けど 。 。 。 ,0.243183581
981,1024,頭 が 良い よう で 悪い ん だろ う な 、 、 、 バレる に 決まっ てる ,悪い なあ コイツ 。 ,0.24310904
63,607,本当に お 気の毒 と しか 言え ない 。 ,本人 が 否定 し てる ので まだ なんとも 言え ない けど 。 ,0.243066187
244,442,奥さん で 実験 し て た とか じゃ ない よ ね … 。 ,これ は 、 慎重 に 捜査 し ない と 、 、 、 この 人 じゃ ない 可能 性 も ある よ 。 ,0.243034635
538,670,お子さん も おら れる のに 、 お母さん が 亡くなり 、 お父さん が 殺人 容疑 で 逮捕 さ れ ただ なんて 、 大変 な こと に なっ て しまい まし た ね 。 ,お母さん は 殺さ れ て 、 お父さん は 刑務所 。 ,0.243028598
327,580,何 が あっ た の でしょ う か ,研究 職 って なかなか 就職 難しい ん でしょ ？ ,0.242981155
752,993,これ で 自殺 の 完全 犯罪 でも 企ん で い た の だろ う か ？ ,自殺 ・ 事故 の 線 は ない の か ？ ,0.242946192
85,618,バイオエタノール 暖炉 も 環境 に やさしい とか 言っ てる が 、 燃料 に は メタノール が 入っ てる し 、 身体 に 良く ない よ ね 。 ,燃料 用 アルコール とか 、 航空機 用 燃料 と か 。 ,0.242940238
381,931,社会 良識 が ある か どう か は 非常 に 大切 な ので 。 ,妻 で ある ま え に ,0.242925807
100,533,離婚 を 選ば なかっ た 理由 が 原因 だろ う な 。 ,嫌 なら 離婚 すれ ば 良い だけ だろ う 。 ,0.242897165
708,763,学歴 も ない し 、 何 の 取り柄 も ない けど 、 仲良し 家族 で よかっ た 。 ,家族 を 実験 台 に し た の か な ？ ,0.242893131
97,232,医者 だって 病死 か どう か は 直ぐ に 分かる 。 ,何 が 不満 な ん だって 人生 や な 。 ,0.242887421
548,860,残さ れ た まだ 幼い 子供 の 行く末 が 心配 だ 。 ,まだ 子供 に 手 を かけ なく て 良かっ た 。 ,0.242834115
690,948,離婚 し て 別居 すれ ば 他人 と なっ て 晴れ晴れ と なる ん だ から ね 。 ,殺害 する くらい なら 離婚 すれ ば よかっ た のに 。 ,0.24277705
279,857,どう やっ て 証拠 を 見つける の だろ う 。 ,子供 も いる のに この 男 は 何 やっ て ん の ？ ,0.242682764
138,1025,別 の 記事 で み た けど 、 夫 は 否定 し てる ん です ね ,やり そう な 外見 し てる と 言え ば し てる か 。 ,0.24265384
101,138,夫 、 否認 し てる 。 ,別 の 記事 で み た けど 、 夫 は 否定 し てる ん です ね ,0.242616269
111,702,血 中 に ギ 酸 が あれ ば メタノール が 怪しい と の こと 。 ,誰 も 聞い た こと や 飲ん だ こと が ない 薬 が 使わ れ た か と 思っ たら 、 メタノール ？ ,0.242525076
225,265,子供 が かわいそう だ 。 ,子供 の 事 を 考えれ ば 、 あり え ない だろ う 。 ,0.242501919
265,348,子供 の 事 を 考えれ ば 、 あり え ない だろ う 。 ,子供 が かわいそう だ 。 ,0.242501919
265,894,子供 の 事 を 考えれ ば 、 あり え ない だろ う 。 ,子供 も かわいそう だ 。 ,0.242501919
298,327,こんなにも 優秀 な 夫婦 な のに 何 が あっ た ん だろ う ？ ,何 が あっ た の でしょ う か ,0.242483898
290,722,子供 の こと を 1 % で も 考え たら 、 そこ まで は ね 。 ,一体 何 考え てる ん だ ？ ,0.242477533
576,589,勿体ない 、 製薬 会社 は 年収 高い し そんなに 殺し たい なら まず 離婚 すれ ば いい し 人生 損 に なる ことし ちゃい まし た ね 。 ,勿体ない です ね ！ ,0.242456018
139,248,よほど の 証拠 が ない と 逮捕 でき ない と 思う けど 、 決定的 な 逮捕 の 決め手 は なん だっ た ん だろ う お母さん は 亡くなっ て お父さん は 逮捕 とか 、 お子さん が かわいそう で なら ない ,お子さん が 気の毒 で なら ない 。 。 。 ,0.242444862
691,745,何で こんな 考え に なる の か 不思議 。 ,こんな 勉強 できる 子 が 犯罪 犯し て 割 に 合わ ない と 考え られ ない の ？ ,0.242376539
442,600,これ は 、 慎重 に 捜査 し ない と 、 、 、 この 人 じゃ ない 可能 性 も ある よ 。 ,そんな とこ じゃ ない か な 。 ,0.242355195
460,883,もし 万が一 だ が 本人 が 製薬 会社 に 勤め て い た 為 に 疑わ れ て の 冤罪 だっ たら ひどい 話 だ と 思う 。 ,もし ワイン に 混入 だっ たら 第 二 の 毒 葡萄 酒 事件 。 ,0.242253868
449,456,母親 を 殺害 し た の が 父親 という 事実 、 せめて 離婚 という 方法 は 取れ なかっ た の でしょ う か ？ ,母親 は 亡くなっ て 父親 は 殺人 容疑 で 逮捕 。 ,0.242236922
863,931,ある と する と 奥さん が 不倫 し て 許せ なかっ た か 、 保険 金 目当て か ？ ,妻 で ある ま え に ,0.242224275
405,907,警察 は 、 状況 だけ で なく 本当に しっかり と 証拠 を 調べ ない と 大変 な こと に なる よ これ 。 ,本当に メタノール ？ ,0.242198694
169,893,奥さん が 京都大 学 大学院 まで 出 て 就職 し て 3 年 で 退職 って とこ に びっくり し て しまっ た 。 ,退職 し た 奥さん の 方 が 優秀 だっ たら 皮肉 だ ね 。 ,0.242181572
169,584,奥さん が 京都大 学 大学院 まで 出 て 就職 し て 3 年 で 退職 って とこ に びっくり し て しまっ た 。 ,そこ じゃ ない だろ ！ と いわ れる と 思い ます が 、 奥様 は 京都大 学 の 大学院 まで で て 、 3 年 で 仕事 を 辞め られ た の です ね 。 ,0.242158638
6,408,薬学 の 知識 が ある 人 が 殺人 を 考える の なら 、 当然 証拠 の 残ら ない 方法 を 考える でしょ う 。 ,これ ほど の 学 と 知識 を 持つ 人 なら ば 、 もっと 体内 に 残ら ず に 、 自然 に 見せかけ られる 方法 も 考え られ た 筈 な のに 。 ,0.242128974
325,823,第 一 三共 、 とばっちり で 気の毒 。 ,製薬 大手 「 第 一 三共 」 ,0.242061882
672,899,夫婦 とも 学歴 すごい な 。 何 が 原因 か わから ん が 幸せ って どこ に ある ん だろ う ね 。 ,最高 学歴 の 　 夫婦 に 何 が 。 。 。 ,0.242038775
499,1000,母 だけ で なく ,不謹慎 だけ と 刑事 物 の ドラマ みたい … 。 ,0.242038116
505,950,学歴 、 知識 、 知能 を ？ ,学歴 まで 出さ なく て も ー 。 ,0.242035869
131,153,家族 で も 、 殺意 を 持た れ たら 怖い です よ 。 ,知ら ない で 混ぜ られ たら 防ぎ よう が ない から 怖い ,0.242025388
92,931,詳しい 続報 が ある まで 意見 は 保留 し ます 。 ,妻 で ある ま え に ,0.242011443
473,501,変 な 話 、 メチルアルコール なら 小学校 に も ある と 思う 。 ,小学生 なら 、 容疑 の 内容 も 理解 できる 部分 が ある と 思う し 。 ,0.241992035
80,131,ていう か 、 家族 に 頼む から 薬物 で 殺さ れ い で ね 、 私 が 疑わ れる から 、 って 冗談 で 言っ た 事 が ある ん だ けど 、 入手 経路 も 特定 さ れ て なく て 、 本人 が 否認 し て て も 、 製薬 会社 勤め って だけ で 逮捕 さ れ た と し たら 、 前 に 家族 に 話し た の が 、 現実 に なり そう で 怖い ,家族 で も 、 殺意 を 持た れ たら 怖い です よ 。 ,0.241981997
169,600,奥さん が 京都大 学 大学院 まで 出 て 就職 し て 3 年 で 退職 って とこ に びっくり し て しまっ た 。 ,そんな とこ じゃ ない か な 。 ,0.241978058
581,672,側 から 見 たら 、 幸せ そう だ が 。 ,夫婦 とも 学歴 すごい な 。 何 が 原因 か わから ん が 幸せ って どこ に ある ん だろ う ね 。 ,0.241851996
215,815,迷惑 千 万 です わ 。 ,もったいない です ね 。 ,0.241829575
589,815,勿体ない です ね ！ ,もったいない です ね 。 ,0.241829575
362,876,学歴 とか 関係 ない の よ 。 ,輝かしい 学歴 、 頭 も よい の だろ う 。 ,0.241819557
201,314,そんな こと 本当に する の か 、 とても 信じ られ ない けど 、 実際 に 死者 が 出 て いる わけ だ から 、 何 か は あっ た ん だろ う けど 、 お互い プロ どうし で メタノール って の が 、 なんとなく 腑 に 落ち ない 。 ,薬品 の プロ が メタノール 使う か 疑問 だ けど ね 。 ,0.241814414
263,580,これ は 起訴 する の 難しい の で は ? ,研究 職 って なかなか 就職 難しい ん でしょ ？ ,0.241768942
793,922,毒 母 は 見 てる だけ 。 ,メタノール の 毒性 なんて 誰 でも 知っ てる 。 ,0.241632099
78,908,バレ ない よう に 持ち だす なら 毎回 0 . 1 ml とか 抜い た の か な 。 ,バレ バレ やん ,0.241616128
213,852,それぞれ 事情 は ある ん でしょ う が 。 ,自殺 に つながる よう な 事情 を 捜査 中 の よう です ね 。 ,0.241590065
235,705,メチルアルコール の 致死 量っ て 凄い 量 じゃ ない の ？ ,何 じゃ これ ！ ,0.241581543
383,893,容疑 者 は 、 薬学 研究 者 として 優秀 な 人 だっ た みたい です ね 。 ,退職 し た 奥さん の 方 が 優秀 だっ たら 皮肉 だ ね 。 ,0.241399274
65,548,まだ 、 10 歳 という 年齢 を 考える と 将来 の 事 が 心配 だ 。 ,残さ れ た まだ 幼い 子供 の 行く末 が 心配 だ 。 ,0.241344079
3,545,ショッキング な ニュース で は あり ます が 、 現時点 で は 警察 が 逮捕 し た と いう だけ です 。 ,警察 は 裏 取 を し て いる よう に 思い ます 。 ,0.241299349
261,512,動機 は 何 だろ う ？ ,物証 は 出 た の だろ う か ？ ,0.241295257
512,975,物証 は 出 た の だろ う か ？ ,動機 は 何 だろ ？ ,0.241295257
307,601,もっと 特殊 な 薬品 な の か と 思っ た が メタノール か 、 、 、 、 単純 ,メタノール か 。 ,0.241205106
665,712,サスペンス ドラマ みたい です が 、 学歴 エリート で も 頭脳 明晰 で は 無い の か 病死 偽装 は 普通 に バレる でしょ う 。 ,エリート 研究 員 が 妻 を 病気 を 偽装 し て 毒殺 。 ,0.241107364
291,998,夫婦 の こと は 夫婦 に しか わから ない けれど 、 お子さん は ショック だろ う な … ,人生 わから ない です 。 ,0.241088725
661,906,ていう か 、 イケメン や なぁ ,イケメン だ から 他 に いい 女 を 見つけ て 奥さん が 邪魔 に なっ た ん でしょ う か ？ ,0.241085466
741,979,人 を 殺す くらい なら 自分 が 死ね ば いい のに 。 ,髪型 と いい 面 つき と いい 。 ,0.241057998
196,391,メタノール って 言う と どこ か で 聞い た と おもっ たら 、 定期 的 に 第三国 で 密造 酒 名目 出回っ て 大勢 死人 が 出る あれ です か ね 。 。 ,で あれ ,0.241048976
992,1001,中 々 の 高学歴 夫婦 ,夫婦 で いくら 稼い で い た ん だろ う 。 ,0.240963752
26,806,まだ 容疑 者 の 段階 な ので 、 冤罪 かも しれ ない し … ,容疑 段階 で は あり ます が 、 母 が 父 に 殺さ れ 、 ひとり 残っ た 子供 が 哀れ すぎる ･･･。 ,0.240919946
23,843,そもそも 、 薬物 に 詳しい 人 が 致死 量 の メタノール 飲ま せ て ばれ ない と は 思わ ない の で は ？ という か 、 そもそも メタノール を 選ぶ ？ ？ ,メタノール を 飲ま せ て 殺し た って ？ ,0.240902809
799,869,本当 、 内情 わかん ない もん だ ね 、 、 殺さ なく て よい だろ う 、 、 息子 いる ん だ よ ,奥様 、 わかん なかっ た の か な ？ ,0.240885757
471,977,和歌山 カレー 事件 の よう に 、 コイツ しか 犯人 は あり 得 ない という 消去 法 で 逮捕 し た と 思う 。 ,逮捕 ＝ 犯人 　 では ない から な 。 ,0.240858754
601,821,メタノール か 。 ,動機 と メタノール の 持ち込み ルート が 分から ない ので ,0.240820759
229,857,何処 が やる の か わから ない けど 、 子供 の 精神 的 ケアー を 手厚く やっ て 欲しい 。 ,子供 も いる のに この 男 は 何 やっ て ん の ？ ,0.240742837
390,815,彼 が 犯人 と し たら 、 メタノール は 劇 物 です ので 、 簡単 に は 入手 は 困難 です 。 ,もったいない です ね 。 ,0.240694448
299,966,勿体ない なぁ ,犯行 は ともかく 、 イケメン だ なぁ 。 ,0.240650364
479,561,記事 に は 、 夫 が 妻 を 殺す 理由 の 説明 が ない 。 ,当人 に 飲む 理由 が ない って 、 、 、 他人 から み たら 自殺 の 理由 が 見当たら ない のに 自殺 し た 人 って ま ぁまぁいますよね 。 。 。 ,0.240617288
139,470,よほど の 証拠 が ない と 逮捕 でき ない と 思う けど 、 決定的 な 逮捕 の 決め手 は なん だっ た ん だろ う お母さん は 亡くなっ て お父さん は 逮捕 とか 、 お子さん が かわいそう で なら ない ,逮捕 の 決め て 、 つまり 証拠 が あっ た の か ？ ,0.240607207
424,480,警察 は 状況 証拠 で 逮捕 し た よう だ が 、 果たして 真相 は いかに 。 ,妻 は どんな 状況 だっ た の ？ ,0.240602713
390,446,彼 が 犯人 と し たら 、 メタノール は 劇 物 です ので 、 簡単 に は 入手 は 困難 です 。 ,犯人 は この 人 な の か ？ ,0.240596134
31,740,しかし 何で こんな 事 を やっ て しまっ た の か 。 ,いつも 思う けど 何で 殺す ん だろ う 。 ,0.240550625
547,979,事実 が 早く 明るみ に なる と いい です ね 。 ,髪型 と いい 面 つき と いい 。 ,0.240496408
409,838,天然 毒 とか も ある だろ う し 。 ,もっと 知ら ない 薬品 とか 手 に 入ら ない 薬 とか あり そう だ けど 。 ,0.240487767
139,538,よほど の 証拠 が ない と 逮捕 でき ない と 思う けど 、 決定的 な 逮捕 の 決め手 は なん だっ た ん だろ う お母さん は 亡くなっ て お父さん は 逮捕 とか 、 お子さん が かわいそう で なら ない ,お子さん も おら れる のに 、 お母さん が 亡くなり 、 お父さん が 殺人 容疑 で 逮捕 さ れ ただ なんて 、 大変 な こと に なっ て しまい まし た ね 。 ,0.240426622
312,421,お子さん が かわいそう で しかた ない 。 ,しかも お子さん が いる 。 ,0.240354414
117,645,どう やっ て 摂取 さ せ た の か 気 に なる メタノール は 化学 系 の 研究 職 なら 馴染み 深い もの な ので 元 研究 者 の 奥さん なら すぐ 違和感 を 感じ た はず と 思う の です が ,薬品 の 研究 者 なら 、 研究 者 らしく 、 髪 を 何とか しろ 。 ,0.240351041
116,608,完全 犯罪 に する 気 は なかっ た ん だろ う と は 思う 。 ,決して 完全 犯罪 を 認め てる わけ で は なく 、 これ だけ 高 学歴 で 知識 の ある 人 なら 、 こんな 殺害 方法 は 持ち い ない ん じゃ ない の か なぁ ？ ,0.240272835
499,973,母 だけ で なく ,単に 別れれ ば いい のに 、 殺さ なく て も ・ ・ ・ ,0.240233596
240,515,小学生 の お子さん 、 今後 が 心配 です 。 ,いろいろ と 興味 が でる 事件 です が 奥様 は お いたわしい です し お子さん が 可哀想 です ね ・ ・ 。 ,0.240014203
584,825,そこ じゃ ない だろ ！ と いわ れる と 思い ます が 、 奥様 は 京都大 学 の 大学院 まで で て 、 3 年 で 仕事 を 辞め られ た の です ね 。 ,亡くなっ た 嫁さん は 、 京都大 大学院 を 修了 後 〜〜〜 ,0.240012532
504,968,社内 の 業務 上 の 死 で は 無 さ そう な のに 、 社名 まで 出さ れる と は 、 風評 被害 、 大丈夫 です か 。 ,1 番 の 被害 者 は 子供 か な ？ ,0.239978782
705,956,何 じゃ これ ！ ,これ は 治験 です 、 失敗 し た だけ です 。 ,0.239945645
427,686,特に 妻 の 学歴 が 凄 すぎ て 。 。 。 ,大手 製薬 会社 の 研究 員 として は ロン 毛 すぎ じゃ ね ？ ,0.239914853
114,162,何で 薬品 に 詳しい 人 が メタノール なんて 使っ た ん だろ う 。 。 。 ,メタノール なんて 簡単 に 入手 できる し どう する ん だろ う これ 。 ,0.239910314
265,328,子供 の 事 を 考えれ ば 、 あり え ない だろ う 。 ,あり 得る の か な 。 ,0.239902326
133,567,学校 の 先生 も 給食 の カレー に 漂白 剤 入れ た 事件 も あり 、 理性 で 抑える こと が 出来 なく なっ てる 。 ,自宅 以外 で 上手い こと し て 入れ られ た とか も あり 得 なく は ない けど ね 。 ,0.239855202
330,779,子ども が かわいそう で 気 に なる 。 ,学歴 も つりあっ て 子ども も い て 、 向上心 が ある 人間 が 何故 ？ ,0.239804504
454,923,夫婦 揃っ て 有名 大 院 から 製薬 会社 。 ,こんな の が 製薬 会社 で 働い て い た こと が 恐ろしい 。 ,0.239795624
