id1,id2,comment1,comment2,similarity
384,418,博士 号 を 取得 し 、 勤務 先 から 海外 の 大学院 に 留学 さ せ て いる 経歴 から 見 て も 、 会社 の 新薬 開発 を 担う エリート だっ た の でしょ う 。 ,夫 は 北海道大学 で 修士 号 を とり 、 千葉大学 で 博士 号 取得 、 アメリカ の 大学 に 2 年間 留学 。 ,0.219119376
771,1008,残さ れ た 子供 さん が 、 不憫 です 。 ,え … 子供 も いる のに … ？ ,0.219109905
550,748,専門 知識 から の 殺人 だ と 、 見過ごさ れ て いる 件 も ある の だろ う な 。 ,薬 の 専門 家 だ から と 言う に は 、 御 粗末 な 事案 だ 確信 犯 的 殺人 、 極刑 確定 だ な 最近 は 、 こんな の ばかり だ ,0.219092276
11,993,警察 は 証拠 を 積み上げ 、 逮捕 に 至る 自殺 か 事件 か わから ない 時 は 余計 に 慎重 に なる だろ う ,自殺 ・ 事故 の 線 は ない の か ？ ,0.219089498
177,286,メタノール なんて なん に でも 入っ てる だろ う 。 ,この 手 の プロフェッショナル な のに 、 メタノール なんて 使う か な ‥ ,0.219076139
210,693,悶絶 する ほど 苦しい ぞ 。 ,殺し た 「 い ほど 憎ん で 」 ,0.21904065
604,682,エタノール で は なく て メタノール 　 普通 の 人 で は 手 に 入ら ない だろ う ね ,自 死 で は ない 証拠 が 出 た の だろ う か 。 ,0.219011664
454,987,夫婦 揃っ て 有名 大 院 から 製薬 会社 。 ,第 一 三共 から も 殺人 者 か ひどい 会社 だ ね ,0.218991996
8,309,ちょっと 不自然 な 気 も し ます 。 ,さすが に これ は 会社 も 気の毒 いくら 社員 の 起こし た 事 と は いえ ちょっと … ,0.218915187
265,1004,子供 の 事 を 考えれ ば 、 あり え ない だろ う 。 ,ドラマ で あり そう な 事件 だ な ,0.218880336
874,1047,嫌 なら 離婚 。 ,いや なら 別れろ よ 笑 ,0.218857565
383,969,容疑 者 は 、 薬学 研究 者 として 優秀 な 人 だっ た みたい です ね 。 ,あー 、 優秀 な 人 だっ た のに 何 が 狂っ て しまっ た ん でしょ う 。 ,0.218820689
793,911,毒 母 は 見 てる だけ 。 ,この 髪型 は 確実 に 誤魔化し てる だろ 。 ,0.218798797
172,569,晩酌 する 際 の お 酒 に メタノール を 混ぜ た の だろ う か ？ ,製薬 会社 の 人間 が わざわざ メタノール なんて 使用 する の だろ う か 。 ,0.218781095
371,853,記事 の 書き方 が 下手くそ ,記事 が 薄く て よく わから ん ,0.218702573
254,503,その まで 言う なら 裏付け が ほぼ でき てる と 言う こと な の か 。 ,その 知識 、 その 技術 、 その 競争 の 中 、 栄誉 の ため なら 理性 は きか ない の か 。 ,0.218673566
376,874,生活 や 子供 の 教育 費 を 考えれ ば 、 母親 たち は 簡単 に は 離婚 でき ない です から ね 。 ,嫌 なら 離婚 。 ,0.218669356
99,552,子供 も いる の に 何故 殺そ う と 思っ た の か ？ ,現に 子供 ひとり いる の だ から 。 ,0.218645013
409,624,天然 毒 とか も ある だろ う し 。 ,間違い で 奥さん が 自分 で メタノール を 口 に する こと が ある だろ う か 。 ,0.218557288
253,648,入社 は 第 三共 どちら でしょ う か ？ ,第 一 三共 も 大した 事 ない な 。 ,0.218530535
440,579,その 理由 が 結婚 で あっ て 今回 の 結果 だ と する と 奥様 の ご 両親 の 無念 さ は いかばかり か 。 ,何 か あっ た の か な 。 ,0.218492613
440,900,その 理由 が 結婚 で あっ て 今回 の 結果 だ と する と 奥様 の ご 両親 の 無念 さ は いかばかり か 。 ,あっ た ん だ 。 。 。 ,0.218492613
159,601,こういう こと さ れる と 、 劇 物 の メタノール が 急 に 毒物 指定 さ れ かね ない 。 ,メタノール か 。 ,0.21848621
100,672,離婚 を 選ば なかっ た 理由 が 原因 だろ う な 。 ,夫婦 とも 学歴 すごい な 。 何 が 原因 か わから ん が 幸せ って どこ に ある ん だろ う ね 。 ,0.218462486
413,618,有毒 の 燃料 アルコール 等 は 誰 でも 簡単 に 買える の だ から 、 良識 と 堅実 な 生活 ＆ 意識 を 失え ば 悲惨 な 事 は 簡単 に 起き 得る ので 、 肝 に 命じ たい 。 ,燃料 用 アルコール とか 、 航空機 用 燃料 と か 。 ,0.218387246
21,714,本人 は 否認 し て いる し 、 明確 な 証拠 が ある という 訳 で も な さ そう 。 ,容疑 者 が 否認 し て いる ので 勝手 な 事 は 言え ない が 続報 が 気 に なる 。 ,0.218381404
361,654,どうして こう なっ た ... ,勉強 出来 すぎる 人間 は 背景 に こう いっ た 裏 の 怖い 顔 が ある の だろ う か 。 ,0.218328693
150,1029,メタノール 、 メチルアルコール … 小さい とき 、 メチルアルコール と 言っ て い た が 、 今 は メタノール が 一般 的 ？ ,メタノール で 殺害 ？ ,0.218323972
64,449,父親 が 母親 を 殺害 し た 事 に 、 どれ だけ ショック を 受け た こと か 、 想像 に 難く ない 。 ,母親 を 殺害 し た の が 父親 という 事実 、 せめて 離婚 という 方法 は 取れ なかっ た の でしょ う か ？ ,0.218258662
298,992,こんなにも 優秀 な 夫婦 な のに 何 が あっ た ん だろ う ？ ,中 々 の 高学歴 夫婦 ,0.218241027
117,783,どう やっ て 摂取 さ せ た の か 気 に なる メタノール は 化学 系 の 研究 職 なら 馴染み 深い もの な ので 元 研究 者 の 奥さん なら すぐ 違和感 を 感じ た はず と 思う の です が ,創 薬 関係 は 闇 が 深い 。 ,0.218218285
201,703,そんな こと 本当に する の か 、 とても 信じ られ ない けど 、 実際 に 死者 が 出 て いる わけ だ から 、 何 か は あっ た ん だろ う けど 、 お互い プロ どうし で メタノール って の が 、 なんとなく 腑 に 落ち ない 。 ,そんな の 、 すぐ に 司法 解剖 で バレ ちゃう と 思う ん だ けど 、 薬剤 の プロ が そんな の 使う もの ？ ,0.218188124
124,703,奥さん に そんな もの を 、 、 詳しく は 分から ない けど 何 か 事情 が 有っ た に せよ 、 命 まで 奪う なんて 酷 すぎる 。 ,そんな の 、 すぐ に 司法 解剖 で バレ ちゃう と 思う ん だ けど 、 薬剤 の プロ が そんな の 使う もの ？ ,0.218177992
225,855,子供 が かわいそう だ 。 ,奥さん 、 子供 の 出産 を 機 に 退職 し た の か 。 ,0.218155847
348,855,子供 が かわいそう だ 。 ,奥さん 、 子供 の 出産 を 機 に 退職 し た の か 。 ,0.218155847
855,894,奥さん 、 子供 の 出産 を 機 に 退職 し た の か 。 ,子供 も かわいそう だ 。 ,0.218155847
598,996,奥さん の 方 が 優秀 だっ た ん だろ う ね 。 ,優秀 な 人間 と 人格 者 は 比例 し ない ,0.218152594
376,974,生活 や 子供 の 教育 費 を 考えれ ば 、 母親 たち は 簡単 に は 離婚 でき ない です から ね 。 ,他 に いい 女 が でき た の か な ？ ,0.218144997
234,868,メタノール って 、 いわゆる メチルアルコール でしょ ？ ,メタノール って 、 臭い キツイ よ ね ？ ,0.218136796
227,814,夫婦 共 に 第 一 三共 の 職員 だっ た の です ね 。 ,経歴 的 に は 、 立派 な 学者 夫婦 です ね 。 ,0.21812132
140,476,会社 に も メタノール が あり ます 。 ,薬品 会社 に 勤める 旦那 が 薬品 で 妻 を 殺し たら 、 すぐ に 疑わ れる と 思い ます 。 ,0.218113892
220,221,二つ 疑問 。 ,医薬品 開発 の 専門 家 が 、 こんな 杜撰 な こと やる か 、 という 疑問 。 ,0.218100957
51,338,でも すぐ わかる から 逮捕 と なる 。 ,子供 は どう なる 。 ,0.218078406
910,985,なんだか 科捜研 の ドラマ に あり そう な 事件 。 ,古畑 任 三郎 が 出 て き そう な 事件 です ね 。 ,0.21802127
555,907,そこで 、 子供 が 母親 の 方 に いく の が 嫌 で 殺害 し た … なんて 事 も あり うる けど 残さ れ た 子供 が 本当に 可愛 そう 。 ,本当に メタノール ？ ,0.218020661
186,873,何より 、 殺さ なく て も 別れれ ば 済む 話 だっ た の で は 。 ,殺さ なく て も 離婚 すれ ば いい のに と 思う の は 私 が 凡人 だ から だろ う か … ,0.218019137
287,1012,これ は 実録 2 時間 ドラマ に し て 欲しい とこ だ な ,ドラマ みたい な 事件 だ な ,0.21800453
27,951,なんとも 言え ませ ん が 、 少なくとも 、 お母さん を 亡くし て 、 お父さん も これから 取調べ ( 逮捕 と なれ ば 帰っ て は 来 ない でしょ う ) と なる 、 小学生 の 息子 さん の こと が 、 不憫 で なり ませ ん 。 ,息子 さん かわいそう だ わ 。 ,0.217997751
367,1025,前髪 雨 降っ てる みたい ,やり そう な 外見 し てる と 言え ば し てる か 。 ,0.217988321
447,469,どちら に し て も 、 慎重 に 捜査 し て もらい たい 。 ,どちら も 凄い エリート です が 、 一体 何 が あっ た の でしょ う か ？ ,0.217986608
840,947,お子さん は お母様 を 亡くさ れ た 上 に 、 父親 が 逮捕 、 それ も 母親 の 殺害 容疑 って 、 、 、 お子さん が 可哀想 すぎる 。 。 ,それ が 妻 に ばれ て 殺害 し た とか ,0.217977219
575,686,以前 に 高校生 が 筋 弛緩 剤 を 合成 し た 犯罪 が あっ た が 、 大手 製薬 会社 の 技術 レベル が それ 以下 だっ た と なる 。 ,大手 製薬 会社 の 研究 員 として は ロン 毛 すぎ じゃ ね ？ ,0.217975725
24,501,1 月 に 亡くなっ て 、 逮捕 まで これ だけ かかる という 事 は 不可解 な 部分 が 多い の だ と 思う 。 ,小学生 なら 、 容疑 の 内容 も 理解 できる 部分 が ある と 思う し 。 ,0.217972349
101,367,夫 、 否認 し てる 。 ,前髪 雨 降っ てる みたい ,0.217954569
463,931,本人 否定 し て いる ので 、 捜査 に 確証 的 な 証拠 が ある の か 知り たい 。 ,妻 で ある ま え に ,0.217952588
770,873,しかし 、 殺さ なく て も ･･･ しかも 、 専門 知識 を 駆使 し て ･･･ ,殺さ なく て も 離婚 すれ ば いい のに と 思う の は 私 が 凡人 だ から だろ う か … ,0.217894516
261,598,動機 は 何 だろ う ？ ,奥さん の 方 が 優秀 だっ た ん だろ う ね 。 ,0.217849993
598,975,奥さん の 方 が 優秀 だっ た ん だろ う ね 。 ,動機 は 何 だろ ？ ,0.217849993
209,234,痛み を 和らげる 研究 し て いる 癖 に メチルアルコール を 使う と は 。 ,メタノール って 、 いわゆる メチルアルコール でしょ ？ ,0.217841101
170,513,第 一 三共 より もっと 良い 会社 が あっ た の か な 。 ,動機 が あっ た ？ ,0.217821966
100,116,離婚 を 選ば なかっ た 理由 が 原因 だろ う な 。 ,完全 犯罪 に する 気 は なかっ た ん だろ う と は 思う 。 ,0.217816273
464,494,また いつも の 自白 する まで 粘る 捜査 で は なく 亡くなっ た 方 の ため に も 真実 を ！ ,亡くなっ て しまっ た 妻 も 。 。 ,0.217774393
745,930,こんな 勉強 できる 子 が 犯罪 犯し て 割 に 合わ ない と 考え られ ない の ？ ,殺人 犯し て 全て が パー だ ね … ,0.21776444
423,778,薬剤 の 専門 家 が 犯行 が すぐ に ばれる よう な こと を する の だろ う か 。 ,仕事 柄 自分 が 疑わ れる よう な こと する か な ？ ,0.217744289
531,771,一 人 息子 さん が いる の に 何故 殺す ？ ,残さ れ た 子供 さん が 、 不憫 です 。 ,0.217737365
551,793,セックス レス の 原因 は 男 だけ で は ない と おもう 。 ,毒 母 は 見 てる だけ 。 ,0.217723902
268,819,何故 メタノール を 選ぶ ？ ,薬品 に 超 詳し そう な エリート の この 方 が そんなに すぐ バレる 殺害 方法 を 選ぶ の か なあ ,0.217698737
279,431,どう やっ て 証拠 を 見つける の だろ う 。 ,何 が 不満 やっ た の やろ う 。 ,0.21768448
176,355,お子さん の 心 の ケア を 大事 に し て あげ て ほしい 。 ,お子さん が 気の毒 だ 。 ,0.217679093
910,1022,なんだか 科捜研 の ドラマ に あり そう な 事件 。 ,まるで ドラマ みたい 。 ,0.217660815
198,751,私 も 製薬 会社 で 研究 者 を し て いる が 、 正直 なぜ メタノール ？ と は 思っ た 。 ,自分 の 研究 し てる メタノール で 殺し て 更に 現場 から メタノール 持ち出し て いる 。 ,0.217613514
286,922,この 手 の プロフェッショナル な のに 、 メタノール なんて 使う か な ‥ ,メタノール の 毒性 なんて 誰 でも 知っ てる 。 ,0.217598559
728,907,本当に 彼 が 起こし た なら 、 せめて 血 中 濃度 とか 代謝 分解 もろもろ 、 頭 使い そう な 気 は する けど 。 ,本当に メタノール ？ ,0.217593962
287,705,これ は 実録 2 時間 ドラマ に し て 欲しい とこ だ な ,何 じゃ これ ！ ,0.217544795
292,610,結婚 が 幸せ と は 限ら ない って こと だ な 。 ,メタノール 中毒 って 、 アルコール 中毒 と 同様 に 遅効 性 の 中毒 だ から 、 家 の 中 で 摂取 し た と は 限ら ない 。 ,0.21754113
77,333,メタノール だ と 劇薬 だ から 1 ml 単位 で 管理 さ れ て ます よ ね 。 ,ラボ から 持ち出し て たら 会社 の 管理 も 問わ れる ね ,0.217516193
153,573,知ら ない で 混ぜ られ たら 防ぎ よう が ない から 怖い ,詳細 が 判 から ない から 、 他殺 な の か 、 自殺 な の か 、 判ら ない が 証拠 が 何処 に も ない という の も 謎 だ よ ね 。 ,0.217491738
478,946,妻 の 不倫 の もつれ で 第三者 の 相手 に 毒 を 盛ら れ た か 、 旦那 の 不倫 が 許せ ず 、 自ら 命 を 断ち 、 旦那 に 濡れ衣 を 着せ た か 。 ,不倫 でも し て たん じゃ ない ？ ,0.217479639
690,766,離婚 し て 別居 すれ ば 他人 と なっ て 晴れ晴れ と なる ん だ から ね 。 ,数 年 前 から 夫婦 関係 は 破綻 し て い て 家庭 内 別居 だっ た みたい です 。 ,0.217478797
457,771,子供 が 可哀想 だ 。 ,残さ れ た 子供 さん が 、 不憫 です 。 ,0.217444871
686,705,大手 製薬 会社 の 研究 員 として は ロン 毛 すぎ じゃ ね ？ ,何 じゃ これ ！ ,0.217433646
443,898,だって 、 これ ほど に 頭 の いい 夫 なら 完全 犯罪 だって 、 でき そう だ から 、 もし やる として も 、 、 、 こんな 殺し 方 する か な 。 ,殺し たい ほど の 何 か が あっ た ん です ね 。 ,0.217417829
574,879,新薬 開発 を 担当 し て い ながら メタノール 。 ,そんな 開発 する ほど 優秀 なら よ せけ んで 騒がし てる コロナ の 特効薬 で も 開発 し て くれ よ ,0.217408773
122,814,これ まで の 立派 な 経緯 や 努力 、 研究 等 、 人生 を 帳消し に し て しまっ た ね 。 ,経歴 的 に は 、 立派 な 学者 夫婦 です ね 。 ,0.217290796
315,648,第 一 三共 信用 出来る 会社 な の ？ ,第 一 三共 も 大した 事 ない な 。 ,0.217269855
405,594,警察 は 、 状況 だけ で なく 本当に しっかり と 証拠 を 調べ ない と 大変 な こと に なる よ これ 。 ,本当に 何 が ある か わから ない 。 ,0.217268687
432,451,年収 １ ０ ０ ０ 万 以上 は 確実 に 稼い で い た と 思う 。 ,半年 以上 経っ て から の 逮捕 。 ,0.217266267
177,304,メタノール なんて なん に でも 入っ てる だろ う 。 ,死ぬ ほど の メタノール を 飲ま せる って 、 チューハイ に でも 混ぜ た の だろ う か ？ ,0.217230741
165,446,この 裁判 の 結果 が どう なる か は 興味深い 。 ,犯人 は この 人 な の か ？ ,0.217204436
260,469,何 が あっ た の か わから ない けど 、 博士 号 まで 取得 し た 人 だ から 、 エリート だ よ ね ？ ,どちら も 凄い エリート です が 、 一体 何 が あっ た の でしょ う か ？ ,0.217175165
554,992,夫婦 間 で 色々 あり 離婚 の 話し が 出 て た の か な … ,中 々 の 高学歴 夫婦 ,0.217167651
137,893,そいつ も 退職 し まし た が 今 は どう し て いる の だろ う か 。 ,退職 し た 奥さん の 方 が 優秀 だっ たら 皮肉 だ ね 。 ,0.21711656
434,927,メタノール って 失明 する だけ じゃ なく 、 少量 で 致死 率 が 高い ん です ね 。 ,新薬 の 実験 台 に さ れ た わけ じゃ なく ？ ,0.217115525
854,931,ん ー 　 正直 この 奥さん 何 か の 機密 を 知っ て 消さ れ た 可能 性 も ある かも ,妻 で ある ま え に ,0.217097364
269,591,他 に 手法 が あり そう な もの だ が 。 ,恥 で も 何 でも あり ませ ん 。 ,0.217063781
195,658,奥さん が よく 飲ま れる 方 なら 、 可能 かも だ けど 。 ,冤罪 事件 に なる 可能 性 が 高 そう だ 。 ,0.217004828
352,568,俺 の 人生 まだ まし だ な 。 ,この 人 を 犯人 と 決める の は まだ 早い の で は ない か ？ ,0.21699908
410,480,本人 は 否認 し て いる ので まだ 不 確定 で は あり ます が 、 この 状況 は 、 お子さん が 可哀想 です 。 ,妻 は どんな 状況 だっ た の ？ ,0.216991411
291,847,夫婦 の こと は 夫婦 に しか わから ない けれど 、 お子さん は ショック だろ う な … ,高学歴 の 夫婦 は 「 知識 」 は あっ て も 「 知恵 」 は ない ん だ ね 。 ,0.216987788
720,722,通常 の 思考 で は 考え られ ない 。 ,一体 何 考え てる ん だ ？ ,0.216982341
446,750,犯人 は この 人 な の か ？ ,この 人 、 勉強 は できる の だろ う けど ホント の 馬鹿 だ 。 ,0.216980837
324,947,薬 の 専門 家 なら もう少し ばれ 難い 方法 で でき なかっ た の か ねぇ 。 ,それ が 妻 に ばれ て 殺害 し た とか ,0.216949191
371,479,記事 の 書き方 が 下手くそ ,記事 に は 、 夫 が 妻 を 殺す 理由 の 説明 が ない 。 ,0.21692708
573,977,詳細 が 判 から ない から 、 他殺 な の か 、 自殺 な の か 、 判ら ない が 証拠 が 何処 に も ない という の も 謎 だ よ ね 。 ,逮捕 ＝ 犯人 　 では ない から な 。 ,0.216906709
37,244,もちろん 、 研究所 や 実験 室 に は 普通 に 置い て あり ます 。 ,奥さん で 実験 し て た とか じゃ ない よ ね … 。 ,0.216899729
68,482,血液 検査 を すれ ば すぐ に バレる と 言う のに 、 よく よく 、 周り が 見え て い ない 。 ,すぐ バレる こと は 分かる でしょ ！ ,0.216896605
629,737,人 を 殺す こと が 出来る もの なんて 、 そこら 中 に ある から 対策 なんて 不可能 でしょ う 。 ,人間 なんて 、 弱い 。 ,0.216895508
511,853,すごく シンプル な 記事 な の です が 、 病死 と 偽装 し た と 書い て あり 別 の 記事 で は メタノール を 飲ま せ た と 書い て あっ た 。 ,記事 が 薄く て よく わから ん ,0.216888885
184,750,特に この よう な お 勉強 出来る 頭 の 良い 方 が こう なる 過程 って 謎 で ある 。 ,この 人 、 勉強 は できる の だろ う けど ホント の 馬鹿 だ 。 ,0.216883454
25,239,決めつけ た よう な 報道 は どう か と 思う 。 ,模倣 犯 が 真似 する と 困る から 、 具体 的 な 薬品 名 は 避け て 報道 し た 方 が 良い と 思う 。 ,0.216843757
162,624,メタノール なんて 簡単 に 入手 できる し どう する ん だろ う これ 。 ,間違い で 奥さん が 自分 で メタノール を 口 に する こと が ある だろ う か 。 ,0.216839886
924,993,自殺 偽装 で は なく 病死 偽装 な の ？ ,自殺 ・ 事故 の 線 は ない の か ？ ,0.216834454
180,972,ここ まで 薬学 の 知識 が ある の に 単純 に メタノール で 殺害 って の に は 違和感 ある なあ 勤務 先 を 考える と 入手 可能 な 薬品 類 で 完全 に バレ ない よう な 殺害 方法 あり そう だ けど ,殺害 だ と し たら 、 薬品 の プロ と は 思え ない 手口 だ けど 、 、 、 ,0.216833321
19,286,メタノール なんて 市販 の 燃料 用 アルコール に 含ま れ てる し 、 家族 に 毒 を 盛ら れる なんて 普通 は 考え ない 。 ,この 手 の プロフェッショナル な のに 、 メタノール なんて 使う か な ‥ ,0.216832721
49,162,因みに メタノール で の 殺人 は ， 簡単 に バレ ます 。 ,メタノール なんて 簡単 に 入手 できる し どう する ん だろ う これ 。 ,0.21679513
36,627,なお 、 メタノール は 燃料 用 アルコール として 、 ホームセンター なんか で も 購入 できる よう な ので 、 どこ から 手 に 入れ た か を 調べる の は 結構 大変 かも しれ ませ ん ね 。 ,メタノール なんて どこ でも 簡単 に 入手 できる 。 ,0.216793439
260,954,何 が あっ た の か わから ない けど 、 博士 号 まで 取得 し た 人 だ から 、 エリート だ よ ね ？ ,動機 が 今一つ わから ない です ね ,0.216792147
152,616,戦後 生まれ だ が 、 戦中 に これ を 飲ん で 失明 … と 言う の を 小さい とき に 耳 に し た 酒 の 変わり に 飲ん で は いけ ない と … 失明 する と ロシア で 酒 に 混ぜ て 販売 し て 死者 も 出 て い た なぁ ,戦後 は メチル 飲ん で たって 、 大きな 間違い です 。 ,0.216789777
422,578,夫婦 の 間 で 一体 何 が あっ た の か 。 ,凄い 優秀 な 夫婦 な のに 。 ,0.216749082
163,410,状況 証拠 で 黒 に できる ん か ね 。 ,本人 は 否認 し て いる ので まだ 不 確定 で は あり ます が 、 この 状況 は 、 お子さん が 可哀想 です 。 ,0.216746133
210,898,悶絶 する ほど 苦しい ぞ 。 ,殺し たい ほど の 何 か が あっ た ん です ね 。 ,0.216731898
212,260,旧 帝 大 出 て 博士 号 も 取っ て 、 留学 まで し て 、 ここ まで 優秀 で 華々しい 人生 を 送っ て た のに なんか 勿体 無い な と 感じる 。 ,何 が あっ た の か わから ない けど 、 博士 号 まで 取得 し た 人 だ から 、 エリート だ よ ね ？ ,0.216670407
513,535,動機 が あっ た ？ ,子供 さん の こと を 思う と 、 自殺 か 何 か で あっ て ほしい 。 ,0.216663052
511,563,すごく シンプル な 記事 な の です が 、 病死 と 偽装 し た と 書い て あり 別 の 記事 で は メタノール を 飲ま せ た と 書い て あっ た 。 ,わかる まで は あまり 記事 に は し て ほしく ない です ね 。 ,0.216660966
5,374,真実 の 究明 を 望み ます が 、 犯人 で ある 事 を 前提 と し た よう な 見方 を する の は 間違っ て いる か と 思い ます 。 ,子供 の こと を 考え ない ところ は 、 不倫 する 男 たち と 同一 線 上 に ある と 思い ます 。 ,0.216626079
50,352,よく ロシア で 偽造 酒 = メタノール で 人 が 死に まし た よ ね 。 ,俺 の 人生 まだ まし だ な 。 ,0.216588288
538,697,お子さん も おら れる のに 、 お母さん が 亡くなり 、 お父さん が 殺人 容疑 で 逮捕 さ れ ただ なんて 、 大変 な こと に なっ て しまい まし た ね 。 ,殺人 犯 。 ,0.216582548
658,963,冤罪 事件 に なる 可能 性 が 高 そう だ 。 ,現代 の 短編 に でも 載っ て そう な 事件 ,0.216567316
327,534,何 が あっ た の でしょ う か ,検死 すれ ば 直ぐ に バレる こと は 分かっ て いる 人 でしょ 。 ,0.216551618
260,419,何 が あっ た の か わから ない けど 、 博士 号 まで 取得 し た 人 だ から 、 エリート だ よ ね ？ ,妻 は 京都大 学 大学院 で 修士 号 を 取得 。 ,0.216506539
118,823,製薬 企業 で R ＆ D (？) に 属し て いる の か な 。 ,製薬 大手 「 第 一 三共 」 ,0.216483324
