id1,id2,comment1,comment2,similarity
2,802,何故 この 様 な 事 を し た の か 当人 しか わから ない が 、 母親 を 失い 父親 は 逮捕 さ れ 残さ れ た 子供 が 哀れ だ 。 ,母親 を 父親 が 実害 し た … ,0.288786316
358,910,ドラマ みたい な 話 ,なんだか 科捜研 の ドラマ に あり そう な 事件 。 ,0.288612527
246,877,研究 者 な のに 、 稚拙 すぎ て 、 逆 に そんな わけ ない だろ う って 思う 。 ,でも 、 行為 は 稚拙 。 ,0.288526145
865,955,殺害 する 程 の 憎悪 と 杜撰 な 殺害 、 相当 メンタル やら れ てる な ,夫 は 殺害 を 否定 。 ,0.288445627
253,327,入社 は 第 三共 どちら でしょ う か ？ ,何 が あっ た の でしょ う か ,0.288313215
312,951,お子さん が かわいそう で しかた ない 。 ,息子 さん かわいそう だ わ 。 ,0.288207569
23,601,そもそも 、 薬物 に 詳しい 人 が 致死 量 の メタノール 飲ま せ て ばれ ない と は 思わ ない の で は ？ という か 、 そもそも メタノール を 選ぶ ？ ？ ,メタノール か 。 ,0.288129287
643,1017,アルコール ランプ の 燃料 で そこら に 売っ てる よ 、 普通 もっと 解明 の でき ない 薬 じゃ 無い の ？ ,顔 が もう 普通 じゃ ない ,0.288109623
5,450,真実 の 究明 を 望み ます が 、 犯人 で ある 事 を 前提 と し た よう な 見方 を する の は 間違っ て いる か と 思い ます 。 ,側 から 見れ ば 裕福 で 幸せ 一 杯 の 家族 に 映り ます が 、 何 が 妻 を 殺害 する 動機 だっ た の か 、 事件 の 究明 を 待ち たい と 思い ます 。 ,0.288051723
338,968,子供 は どう なる 。 ,1 番 の 被害 者 は 子供 か な ？ ,0.288027246
259,887,なんか 、 コナン の 事件 とか に 出 て き そう な 事件 。 ,怪しい 事件 です 。 ,0.287932587
486,678,警察 は それなり の 理由 が あっ て 、 逮捕 、 起訴 に 持っ て いく の か ？ ,逮捕 時 の 容疑 者 の 表情 を 見る 限り 冤罪 と は 思え ない 警察 も それなり の 証拠 が 揃っ た うえ で 逮捕 に 踏み切っ た の だろ う ,0.287919411
532,720,信じ られ ない 。 ,通常 の 思考 で は 考え られ ない 。 ,0.287830855
259,1021,なんか 、 コナン の 事件 とか に 出 て き そう な 事件 。 ,そのまま 古畑 とか ガリ レオ の ネタ に なり そう な 事件 だ よ ね ｗ ,0.287784919
111,282,血 中 に ギ 酸 が あれ ば メタノール が 怪しい と の こと 。 ,知識 が あれ ば 、 メタノール より 有効 な もの 、 いっぱい あり そう 。 ,0.28777563
71,163,残念 ながら 、 半径 1 メートル の 外 に 、 犯行 を 立証 できる 証拠 は 揃っ て い まし た よ 。 ,状況 証拠 で 黒 に できる ん か ね 。 ,0.287699113
232,998,何 が 不満 な ん だって 人生 や な 。 ,人生 わから ない です 。 ,0.287536085
604,1017,エタノール で は なく て メタノール 　 普通 の 人 で は 手 に 入ら ない だろ う ね ,顔 が もう 普通 じゃ ない ,0.287529549
539,917,奥さん も もちろん です が 、 状況 から 見 て お子さん が 一番 気の毒 に 思い ます 。 ,子供 が 気の毒 ,0.287373251
410,607,本人 は 否認 し て いる ので まだ 不 確定 で は あり ます が 、 この 状況 は 、 お子さん が 可哀想 です 。 ,本人 が 否定 し てる ので まだ なんとも 言え ない けど 。 ,0.287317371
407,646,なん で あえて メタノール なんて 選ん だ の か なぁ 。 ,なん だ 、 その 髪 は ? ,0.287293901
723,974,嫌 なら 離婚 すれ ば いい だけ だろ 。 ,他 に いい 女 が でき た の か な ？ ,0.287170652
138,793,別 の 記事 で み た けど 、 夫 は 否定 し てる ん です ね ,毒 母 は 見 てる だけ 。 ,0.287119097
213,327,それぞれ 事情 は ある ん でしょ う が 。 ,何 が あっ た の でしょ う か ,0.287109169
234,327,メタノール って 、 いわゆる メチルアルコール でしょ ？ ,何 が あっ た の でしょ う か ,0.287007372
26,270,まだ 容疑 者 の 段階 な ので 、 冤罪 かも しれ ない し … ,冤罪 の 感 あり 。 ,0.286983248
273,339,側 から 見る と 羨ましい 環境 だ と 思う の です が 、 分から ん もん です ね … 奥さん や 子供 が かわいそう ,かわいそう だ 。 ,0.286914913
580,758,研究 職 って なかなか 就職 難しい ん でしょ ？ ,完全 犯罪 は なかなか 出来 ない よ ね 。 ,0.286845985
170,315,第 一 三共 より もっと 良い 会社 が あっ た の か な 。 ,第 一 三共 信用 出来る 会社 な の ？ ,0.286801875
260,998,何 が あっ た の か わから ない けど 、 博士 号 まで 取得 し た 人 だ から 、 エリート だ よ ね ？ ,人生 わから ない です 。 ,0.286599701
495,1010,この 家族 の 御 近所 で の 様子 とか 含め 謎 多い 気 が し ます な 。 。 。 ,変 な 事件 多い よ ！ ？ ,0.286515769
1006,1032,もう 終わり や の ,第 一 三共 サイテー や な もう 薬 飲ま へん ！ ,0.286479047
1010,1012,変 な 事件 多い よ ！ ？ ,ドラマ みたい な 事件 だ な ,0.286431917
147,604,メタノール の 臭い は 、 比較的 エタノール の それ に 近く て 割 と 弱い ので 、 エタノール （ いわゆる アルコール です ね ） 臭 の する お 酒 に 混ぜ られ て も 気 が つき にくい の で は ない か と 思い ます 。 ,エタノール で は なく て メタノール 　 普通 の 人 で は 手 に 入ら ない だろ う ね ,0.286290466
402,475,なんか 不思議 な ん だ けど 。 ,なんか 相棒 で あり そう な 事件 です ね 。 ,0.286216714
273,631,側 から 見る と 羨ましい 環境 だ と 思う の です が 、 分から ん もん です ね … 奥さん や 子供 が かわいそう ,残さ れ た 子供 が かわいそう だ な ・ ・ ・ ・ ,0.286139892
273,673,側 から 見る と 羨ましい 環境 だ と 思う の です が 、 分から ん もん です ね … 奥さん や 子供 が かわいそう ,子供 が 一 人 残さ れ て かわいそう だ よ 。 ,0.286139892
77,650,メタノール だ と 劇薬 だ から 1 ml 単位 で 管理 さ れ て ます よ ね 。 ,もし 、 管理 体制 に 問題 なかっ た なら ば 、 多分 … 劇薬 メタノール を 内密 に 工面 し た 共犯 者 が いる の で は ない か ? ,0.286015489
362,505,学歴 とか 関係 ない の よ 。 ,学歴 、 知識 、 知能 を ？ ,0.285991469
275,277,母 に よる と 、 母 の 叔父 が 「 メチル 飲ん で 死ん だ 」 ,戦中 ・ 戦後 の 物 の 無い 時代 に は メチル で 死ん だ 酒飲み が 続出 し た 。 ,0.285962574
625,1038,間違い で なけれ ば 覚悟 の 自殺 な の か ？ ,馬鹿 な こと を し た の は 間違い ない 。 ,0.285942803
218,672,すごい ハイスペック 夫婦 で 驚き 。 ,夫婦 とも 学歴 すごい な 。 何 が 原因 か わから ん が 幸せ って どこ に ある ん だろ う ね 。 ,0.285937867
287,603,これ は 実録 2 時間 ドラマ に し て 欲しい とこ だ な ,時間 かけ た の か な 。 ,0.285906182
388,443,子供 だって 「 自分 の 父 が 、 自分 の 母 を 殺し た 」 と 云う 事実 を 理解 する 年頃 に なる と 、 どんな 思い が する か 想像 も でき なかっ た の でしょ う か 。 ,だって 、 これ ほど に 頭 の いい 夫 なら 完全 犯罪 だって 、 でき そう だ から 、 もし やる として も 、 、 、 こんな 殺し 方 する か な 。 ,0.285896641
321,951,残さ れ た 子供 が 心配 で かわいそう です 。 ,息子 さん かわいそう だ わ 。 ,0.285840235
373,499,見つかる から やら ない だけ で 。 ,母 だけ で なく ,0.285790036
162,569,メタノール なんて 簡単 に 入手 できる し どう する ん だろ う これ 。 ,製薬 会社 の 人間 が わざわざ メタノール なんて 使用 する の だろ う か 。 ,0.285713534
839,935,本当に やっ た の か な ？ ,詳細 と 本当に 殺害 か わから ない から なんとも 。 ,0.28570785
449,802,母親 を 殺害 し た の が 父親 という 事実 、 せめて 離婚 という 方法 は 取れ なかっ た の でしょ う か ？ ,母親 を 父親 が 実害 し た … ,0.285655691
476,660,薬品 会社 に 勤める 旦那 が 薬品 で 妻 を 殺し たら 、 すぐ に 疑わ れる と 思い ます 。 ,旦那 さん は 、 薬学 知識 が あり 、 薬品 会社 の 研究 室 に お 勤め 、 メタノール を 使用 し て いる 。 ,0.285430327
478,863,妻 の 不倫 の もつれ で 第三者 の 相手 に 毒 を 盛ら れ た か 、 旦那 の 不倫 が 許せ ず 、 自ら 命 を 断ち 、 旦那 に 濡れ衣 を 着せ た か 。 ,ある と する と 奥さん が 不倫 し て 許せ なかっ た か 、 保険 金 目当て か ？ ,0.285385514
521,767,優秀 な 頭脳 明晰 同士 の 結婚 は ケンカ と なる と 性格 が 合わ なかっ たら 激し そう 。 ,まずは 、 頭脳 明晰 な お 二 人 が 何故 ？ ,0.285286148
633,838,メーカー に 入ら ない で 良かっ た 。 ,もっと 知ら ない 薬品 とか 手 に 入ら ない 薬 とか あり そう だ けど 。 ,0.28523964
293,351,人生 色々 ある ぜ ,人生 って そんな もん か 。 ,0.285140352
405,424,警察 は 、 状況 だけ で なく 本当に しっかり と 証拠 を 調べ ない と 大変 な こと に なる よ これ 。 ,警察 は 状況 証拠 で 逮捕 し た よう だ が 、 果たして 真相 は いかに 。 ,0.285133854
182,609,殺害 する ほど の 憎しみ って どんな 事 が きっかけ な の だろ う 。 ,お子さん は 今 どんな 気持ち だろ う 。 ,0.285107114
19,177,メタノール なんて 市販 の 燃料 用 アルコール に 含ま れ てる し 、 家族 に 毒 を 盛ら れる なんて 普通 は 考え ない 。 ,メタノール なんて なん に でも 入っ てる だろ う 。 ,0.284982271
130,702,他 人事 だ と 思っ て たら です よ ね 。 ,誰 も 聞い た こと や 飲ん だ こと が ない 薬 が 使わ れ た か と 思っ たら 、 メタノール ？ ,0.284975513
113,223,何 が あっ た の か 知ら ない が 。 ,一体 何 が あっ た の だろ う か ？ ,0.28486353
278,1010,これ は 難しい 事件 。 ,変 な 事件 多い よ ！ ？ ,0.284808485
47,763,しかも 理化学 実験 で は 頻繁 に 使う 薬品 。 ,家族 を 実験 台 に し た の か な ？ ,0.284590507
578,664,凄い 優秀 な 夫婦 な のに 。 ,容疑 者 は 写真 見た目 で 派手 な 芸能人 みたい です が 、 夫婦 共 に 経歴 が 凄い です ね 。 ,0.284507837
535,849,子供 さん の こと を 思う と 、 自殺 か 何 か で あっ て ほしい 。 ,自殺 の 可能 性 は ない の 。 ,0.284417616
859,861,奥さん を 殺す なんて 鬼畜 以外 の 何者 で も ない 。 ,鬼畜 は 鬼畜 らしく 極刑 を と 言い たい が 、 無期 懲役 が 関の山 か な 。 ,0.284332563
518,601,凶器 は 奥さん と の 思い出 の メタノール 。 ,メタノール か 。 ,0.284278629
513,821,動機 が あっ た ？ ,動機 と メタノール の 持ち込み ルート が 分から ない ので ,0.284237851
419,716,妻 は 京都大 学 大学院 で 修士 号 を 取得 。 ,奥様 も 薬学 修士 修了 ？ ,0.284222727
516,557,痛み を やわらげる 研究 の 果て に 、 心 の 痛み も 亡くし て しまっ た マッドドクター 。 ,研究 中 の 技術 を 用い て 痛み なく サツガイ し た ん でしょ う か ね … ,0.284190791
63,684,本当に お 気の毒 と しか 言え ない 。 ,本当に この 人 が やっ た の ？ ,0.284158623
129,768,それだけ の 才能 が ある の なら 、 もっと 他 に 考え方 、 方法 、 生き方 が あっ た と 思う けど 、 本人 の 中 で は それ しか 選択肢 が なかっ た の か と 。 。 ,離婚 という 選択肢 は ！ なかっ た の か な ？ ,0.283977447
2,980,何故 この 様 な 事 を し た の か 当人 しか わから ない が 、 母親 を 失い 父親 は 逮捕 さ れ 残さ れ た 子供 が 哀れ だ 。 ,母親 を 父親 に 毒殺 さ れ 、 残さ れ た お子さん が 不憫 で 可哀想 過ぎる 、 、 、 ,0.283958232
272,713,恐い 事件 、 まるで ドラマ の よう 、 どうして バレ た の か 、 お子さん の 状態 が とても 心配 。 ,まるで クライムドラマ の よう な 話 。 ,0.283952774
128,691,こんな 人 は メタノール 以外 も 自由 に 手 に 入り そう な のに なんで メタノール な の か も 不思議 です よ ね ,何で こんな 考え に なる の か 不思議 。 ,0.283884141
290,374,子供 の こと を 1 % で も 考え たら 、 そこ まで は ね 。 ,子供 の こと を 考え ない ところ は 、 不倫 する 男 たち と 同一 線 上 に ある と 思い ます 。 ,0.283861923
686,796,大手 製薬 会社 の 研究 員 として は ロン 毛 すぎ じゃ ね ？ ,頭 悪い すぎ 。 ,0.283686416
167,198,製薬 会社 の 研究 員 と 、 エタノール 、 を 結びつけ たかっ た の だろ う か 。 ,私 も 製薬 会社 で 研究 者 を し て いる が 、 正直 なぜ メタノール ？ と は 思っ た 。 ,0.283614446
378,584,奥様 も 、 まさか そこ まで やる と は 考え なかっ た の でしょ う ね 。 ,そこ じゃ ない だろ ！ と いわ れる と 思い ます が 、 奥様 は 京都大 学 の 大学院 まで で て 、 3 年 で 仕事 を 辞め られ た の です ね 。 ,0.283614271
335,354,何 が 有っ た ん だろ う 。 ,何 が あっ た ん だろ う か ？ ,0.283489443
335,936,何 が 有っ た ん だろ う 。 ,何 か あっ た ん だろ う ね ,0.283489443
225,1020,子供 が かわいそう だ 。 ,残さ れ た 子供 が 不憫 ,0.28345704
348,1020,子供 が かわいそう だ 。 ,残さ れ た 子供 が 不憫 ,0.28345704
894,1020,子供 も かわいそう だ 。 ,残さ れ た 子供 が 不憫 ,0.28345704
180,819,ここ まで 薬学 の 知識 が ある の に 単純 に メタノール で 殺害 って の に は 違和感 ある なあ 勤務 先 を 考える と 入手 可能 な 薬品 類 で 完全 に バレ ない よう な 殺害 方法 あり そう だ けど ,薬品 に 超 詳し そう な エリート の この 方 が そんなに すぐ バレる 殺害 方法 を 選ぶ の か なあ ,0.283436483
113,797,何 が あっ た の か 知ら ない が 。 ,まさか 、 離婚 という 制度 が ある こと 知ら なかっ た ん じゃ ない か と 疑う レベル ,0.283434115
124,335,奥さん に そんな もの を 、 、 詳しく は 分から ない けど 何 か 事情 が 有っ た に せよ 、 命 まで 奪う なんて 酷 すぎる 。 ,何 が 有っ た ん だろ う 。 ,0.283369308
552,806,現に 子供 ひとり いる の だ から 。 ,容疑 段階 で は あり ます が 、 母 が 父 に 殺さ れ 、 ひとり 残っ た 子供 が 哀れ すぎる ･･･。 ,0.283288117
232,606,何 が 不満 な ん だって 人生 や な 。 ,人生 終わっ た ね ,0.283256249
63,346,本当に お 気の毒 と しか 言え ない 。 ,お子さん が 本当に 心配 ,0.283121053
346,421,お子さん が 本当に 心配 ,しかも お子さん が いる 。 ,0.283074495
19,922,メタノール なんて 市販 の 燃料 用 アルコール に 含ま れ てる し 、 家族 に 毒 を 盛ら れる なんて 普通 は 考え ない 。 ,メタノール の 毒性 なんて 誰 でも 知っ てる 。 ,0.283060181
21,276,本人 は 否認 し て いる し 、 明確 な 証拠 が ある という 訳 で も な さ そう 。 ,そう だ 。 ,0.283042364
21,937,本人 は 否認 し て いる し 、 明確 な 証拠 が ある という 訳 で も な さ そう 。 ,根 は 深 そう だ ,0.283042364
423,657,薬剤 の 専門 家 が 犯行 が すぐ に ばれる よう な こと を する の だろ う か 。 ,こんな すぐ に ばれる 幼稚 な 手口 を 使う と も 思わ れ ない 。 ,0.283014658
354,817,何 が あっ た ん だろ う か ？ ,コンプレックス とか あっ た の かしら … ,0.283009362
817,936,コンプレックス とか あっ た の かしら … ,何 か あっ た ん だろ う ね ,0.283009362
195,849,奥さん が よく 飲ま れる 方 なら 、 可能 かも だ けど 。 ,自殺 の 可能 性 は ない の 。 ,0.283008089
37,140,もちろん 、 研究所 や 実験 室 に は 普通 に 置い て あり ます 。 ,会社 に も メタノール が あり ます 。 ,0.28298632
265,270,子供 の 事 を 考えれ ば 、 あり え ない だろ う 。 ,冤罪 の 感 あり 。 ,0.282969613
952,1022,２ 時間 ドラマ の よう な 事件 ,まるで ドラマ みたい 。 ,0.282890981
190,1010,メタノール は どこ でも 手 に 入る し 、 致死 量 も 確か 結構 多い 。 ,変 な 事件 多い よ ！ ？ ,0.282789711
337,724,大手 で 経済 的 に も 困っ て ない だろ う に ,シン ママ に なっ た 方 が 経済 的 に も 楽 だ し 、 ウィンウィン だろ 。 ,0.282740737
456,549,母親 は 亡くなっ て 父親 は 殺人 容疑 で 逮捕 。 ,父親 に 母親 を 殺さ れ 、 恐らく 親戚 筋 に 預け られる の だろ う か 。 ,0.282584785
26,626,まだ 容疑 者 の 段階 な ので 、 冤罪 かも しれ ない し … ,今 の 段階 で は なんと も わから ない が 。 ,0.282560579
515,760,いろいろ と 興味 が でる 事件 です が 奥様 は お いたわしい です し お子さん が 可哀想 です ね ・ ・ 。 ,お子さん も 被害 者 も 気の毒 です ね 。 ,0.282479276
153,532,知ら ない で 混ぜ られ たら 防ぎ よう が ない から 怖い ,信じ られ ない 。 ,0.282442437
990,994,まだ 容疑 者 の 段階 や で 。 ,容疑 者 の Tシャツ 。 。 。 ,0.282435205
646,1042,なん だ 、 その 髪 は ? ,なん や 知ら ん が 、 前髪 を 切り なさい ！ ,0.282423784
544,686,まして 、 製薬 会社 て 、 、 、 ,大手 製薬 会社 の 研究 員 として は ロン 毛 すぎ じゃ ね ？ ,0.282385255
556,579,優秀 な 頭脳 が あっ て も 、 自分 の 人生 を 狂わせ て しまう と は 。 ,何 か あっ た の か な 。 ,0.282242246
556,900,優秀 な 頭脳 が あっ て も 、 自分 の 人生 を 狂わせ て しまう と は 。 ,あっ た ん だ 。 。 。 ,0.282242246
575,823,以前 に 高校生 が 筋 弛緩 剤 を 合成 し た 犯罪 が あっ た が 、 大手 製薬 会社 の 技術 レベル が それ 以下 だっ た と なる 。 ,製薬 大手 「 第 一 三共 」 ,0.282233061
59,891,アルコール ランプ の 燃料 は メタノール です よ ね 。 ,メタノール は 工業 用 アルコール で 猛毒 。 ,0.282224705
463,680,本人 否定 し て いる ので 、 捜査 に 確証 的 な 証拠 が ある の か 知り たい 。 ,本人 否定 し てる し まだ 真相 は 分から ん な 。 ,0.281975366
383,664,容疑 者 は 、 薬学 研究 者 として 優秀 な 人 だっ た みたい です ね 。 ,容疑 者 は 写真 見た目 で 派手 な 芸能人 みたい です が 、 夫婦 共 に 経歴 が 凄い です ね 。 ,0.281944876
23,268,そもそも 、 薬物 に 詳しい 人 が 致死 量 の メタノール 飲ま せ て ばれ ない と は 思わ ない の で は ？ という か 、 そもそも メタノール を 選ぶ ？ ？ ,何故 メタノール を 選ぶ ？ ,0.281869885
608,705,決して 完全 犯罪 を 認め てる わけ で は なく 、 これ だけ 高 学歴 で 知識 の ある 人 なら 、 こんな 殺害 方法 は 持ち い ない ん じゃ ない の か なぁ ？ ,何 じゃ これ ！ ,0.281860487
224,845,普通 に 話し合っ て 離婚 出来 なかっ た の か ？ ,離婚 を 切り出さ れ た 、 あるいは 離婚 を し たく て も 聞き入れ て もらえ なかっ た の か 。 ,0.281770904
269,475,他 に 手法 が あり そう な もの だ が 。 ,なんか 相棒 で あり そう な 事件 です ね 。 ,0.281701813
460,836,もし 万が一 だ が 本人 が 製薬 会社 に 勤め て い た 為 に 疑わ れ て の 冤罪 だっ たら ひどい 話 だ と 思う 。 ,冤罪 ？ ,0.281696372
1042,1049,なん や 知ら ん が 、 前髪 を 切り なさい ！ ,前髪 やばい 、 、 ,0.2816914
258,1029,なんで メタノール ？ ,メタノール で 殺害 ？ ,0.28165883
328,591,あり 得る の か な 。 ,恥 で も 何 でも あり ませ ん 。 ,0.281477448
246,796,研究 者 な のに 、 稚拙 すぎ て 、 逆 に そんな わけ ない だろ う って 思う 。 ,頭 悪い すぎ 。 ,0.281464077
93,296,第 一 三共 の 新薬 開発 研究 者 なら この よう に わかり やすい 、 見つかり やすい 試薬 は 使う 訳 が ない 。 ,製薬 の プロ が こんな 分かり やすい 手口 使う の か な ？ ,0.281437692
526,595,子供 に対する 世間 の 目 は 研究 者 の 息子 から 殺人 犯 の 息子 に なる 。 ,息子 さん の こと を 思う と 、 いたたまれない 。 ,0.281412435
550,931,専門 知識 から の 殺人 だ と 、 見過ごさ れ て いる 件 も ある の だろ う な 。 ,妻 で ある ま え に ,0.281315277
148,905,メタノール の その よう な 具体 的 な 性質 を 知っ て いる 人 だ から こそ 、 でき た こと の よう に 感じ まし た 。 ,見 た 感じ ,0.28129443
401,455,冤罪 じゃ ない の か ？ ,家庭 内 の こと は 分から ない が 、 形 だけ 見 たら 絵 に 描い た よう な エリート 夫婦 じゃ ない か 。 ,0.281222351
314,601,薬品 の プロ が メタノール 使う か 疑問 だ けど ね 。 ,メタノール か 。 ,0.281107329
174,311,お子さん が 心配 です ね 。 ,おいおい 、 お子さん いる の か … 。 ,0.281076906
37,394,もちろん 、 研究所 や 実験 室 に は 普通 に 置い て あり ます 。 ,また 、 人体 実験 を 行っ た と し たら 、 彼 は もちろん だ が 、 会社 の 採用 、 社員 教育 、 上司 の マネージメント など 考える べき 点 が 多く あり ます 。 ,0.281075993
625,849,間違い で なけれ ば 覚悟 の 自殺 な の か ？ ,自殺 の 可能 性 は ない の 。 ,0.281053433
734,1038,夫婦 間 の こと は 、 他人 が 言う こと で は ない 。 ,馬鹿 な こと を し た の は 間違い ない 。 ,0.281049722
362,899,学歴 とか 関係 ない の よ 。 ,最高 学歴 の 　 夫婦 に 何 が 。 。 。 ,0.281041908
240,760,小学生 の お子さん 、 今後 が 心配 です 。 ,お子さん も 被害 者 も 気の毒 です ね 。 ,0.281022215
793,1027,毒 母 は 見 てる だけ 。 ,薬局 で 売っ てる な ,0.281017928
678,682,逮捕 時 の 容疑 者 の 表情 を 見る 限り 冤罪 と は 思え ない 警察 も それなり の 証拠 が 揃っ た うえ で 逮捕 に 踏み切っ た の だろ う ,自 死 で は ない 証拠 が 出 た の だろ う か 。 ,0.280979184
631,917,残さ れ た 子供 が かわいそう だ な ・ ・ ・ ・ ,子供 が 気の毒 ,0.280897218
673,917,子供 が 一 人 残さ れ て かわいそう だ よ 。 ,子供 が 気の毒 ,0.280897218
526,970,子供 に対する 世間 の 目 は 研究 者 の 息子 から 殺人 犯 の 息子 に なる 。 ,息子 さん が かわいそう で なり ませ ん 。 ,0.280845967
349,917,子供 が 不憫 で なら ない ・ ・ ・ 。 ,子供 が 気の毒 ,0.28083683
350,917,子供 が 不憫 で なら ない ,子供 が 気の毒 ,0.28083683
327,482,何 が あっ た の でしょ う か ,すぐ バレる こと は 分かる でしょ ！ ,0.28071448
11,444,警察 は 証拠 を 積み上げ 、 逮捕 に 至る 自殺 か 事件 か わから ない 時 は 余計 に 慎重 に なる だろ う ,自殺 か ？ ,0.280602769
276,963,そう だ 。 ,現代 の 短編 に でも 載っ て そう な 事件 ,0.280596557
937,963,根 は 深 そう だ ,現代 の 短編 に でも 載っ て そう な 事件 ,0.280596557
261,682,動機 は 何 だろ う ？ ,自 死 で は ない 証拠 が 出 た の だろ う か 。 ,0.280578871
682,975,自 死 で は ない 証拠 が 出 た の だろ う か 。 ,動機 は 何 だろ ？ ,0.280578871
